{
  "schema_id": "t6_coordinator_role_registry_v5",
  "schema_version": 5,
  "registry_id": "t6_coordinator_role_registry_v5",
  "status": "HEAD_BOUND_Q1_ROOT_V1_BASE_ADMISSION_AUTHORITY_NO_QUEUE_OR_SUCCESSOR",
  "activation_status": "ACTIVE_EXACT_HEAD_AUTHORITY",
  "authority_policy": {
    "source": "TRACKED_GIT_OBJECTS_AT_EXACT_REQUESTED_HEAD",
    "caller_override_authority": false,
    "worktree_authority": false,
    "fixed_owner_domain": "ordinary_parentless_q1_g_root_v1",
    "inherited_v3_registry_id": "t6_coordinator_role_registry_v3",
    "inherited_v4_registry_id": "t6_coordinator_role_registry_v4",
    "new_roles": [
      "INDEPENDENT_Q1_ROOT_V1_BASE_ADMISSION_VERIFIER",
      "Q1_ROOT_V1_BASE_MATERIALIZER"
    ],
    "base_semantic_excludes_v4_e1_and_candidate": true
  },
  "artifacts": [
    {
      "artifact_id": "q1_root_v1_base_admission_orchestrator_v1",
      "artifact_class": "CONTROLLED_LOADER_ORCHESTRATOR_ONLY",
      "kind": "PYTHON_SYMBOL_SET",
      "path": "scripts/t6_q_one_root_v1_base_admission_orchestrator_v1.py",
      "symbols": [
        "assemble_q_one_root_v1_base_admission_v1"
      ],
      "pin_status": "PINNED",
      "semantic_digest_method": "PYTHON_STABLE_AST_SYMBOL_SET_BLOB_CLOSURE_DEPENDENCY_SHA256_V5",
      "dependency_manifest": {
        "execution_artifact_ids": [
          "q1_root_v1_base_admission_verifier_v1",
          "q1_root_v1_base_materializer_v1",
          "q1_root_v1_terminal_adapter_v1",
          "v1_persistent_state_contract_dependency",
          "v3_production_receipt_verifier_dependency",
          "v3_root_initializer_dependency",
          "v4_owner_classifier_dependency",
          "v4_registry_resolver_dependency",
          "v4_scope_validator_dependency"
        ],
        "binding_artifact_ids": [],
        "binding_document_ids": [
          "data/t6-wave1/t6-coordinator-role-registry-v5.json",
          "schemas/t6-coordinator-role-registry-v5.schema.json",
          "schemas/t6-q-one-root-v1-base-admission-v1.schema.json",
          "scripts/t6_coordinator_role_registry_v5.py"
        ],
        "artifact_semantic_pins": {
          "q1_root_v1_base_admission_verifier_v1": "4fda677482ad484324281e49b1954de1ecfe1b04171aa582b5be767efd19e386",
          "q1_root_v1_base_materializer_v1": "6ea92f3962e4a25a58ed22cb32c54eadffbc7051f58fec69d361a71b072f92d9",
          "q1_root_v1_terminal_adapter_v1": "de912a0b385733faca21e8386be74b6db8b8006db526110625e512523d909321",
          "v1_persistent_state_contract_dependency": "f191dda2210195599ebbebd9aaa417513b695871b5884e8805f0c408a67a494f",
          "v3_production_receipt_verifier_dependency": "3b1d393fca94b81e7fe9acc8282b1543b591e1936f05efc6682fc7b9744323bc",
          "v3_root_initializer_dependency": "3d9870c8bcd22eb234c74850ed17b47723f9ef19d281cf90fb191a2a1f37371f",
          "v4_owner_classifier_dependency": "bfa1e7b07af56db15f3205db97964315dda123f3e76854ecc8e8d3ed9decc735",
          "v4_registry_resolver_dependency": "fcd2ba17b75761bd7c30c08ecf6204e7f97ec4735defd51fa7f7ca38e8fe78d3",
          "v4_scope_validator_dependency": "6bafd43416b27ae6f03486427a9705bc0d9fba2ef525a435abee819dc5de534d"
        }
      },
      "expected_blob_sha256": "9e6404d32aaf3857cc7a680db2fd411d008bd80fc7eb7417c5d6e537ccb64e5e",
      "expected_symbol_ast_sha256": {
        "assemble_q_one_root_v1_base_admission_v1": "cc1334e83ad3f010bcc7749ea264023cdef7397da480d019439c29731db7b326"
      },
      "expected_symbol_set_digest": "ee6b77853cc1c9ca8dcbddb46485edb1aaa9a51edaa854f2fab3070557830bc7",
      "expected_local_import_closure_digest": "632a6b7da17155cbe32e6450329bf555d7042ea74bee00a7ca4462971304dd0e",
      "expected_dependency_manifest_digest": "381650843f7722a69bfaa2fb5e0ba3c33db57eb0609426331e87ac4e1c89c540",
      "expected_semantic_sha256": "169941d9369600db00cecffef380098f8e36d68fc1ee90e7cf23177ddea59937"
    },
    {
      "artifact_id": "q1_root_v1_base_admission_receipt_verifier_v1",
      "artifact_class": "POST_ISSUANCE_REPLAY_DEPENDENCY_ONLY",
      "kind": "PYTHON_SYMBOL_SET",
      "path": "scripts/t6_q_one_root_v1_base_admission_receipt_verifier_v1.py",
      "symbols": [
        "verify_q_one_root_v1_base_admission_receipt_v1"
      ],
      "pin_status": "PINNED",
      "semantic_digest_method": "PYTHON_STABLE_AST_SYMBOL_SET_BLOB_CLOSURE_DEPENDENCY_SHA256_V5",
      "dependency_manifest": {
        "execution_artifact_ids": [
          "q1_root_v1_base_admission_verifier_v1",
          "q1_root_v1_base_materializer_v1",
          "q1_root_v1_terminal_adapter_v1",
          "v1_persistent_state_contract_dependency",
          "v3_production_receipt_verifier_dependency",
          "v3_root_initializer_dependency",
          "v4_owner_classifier_dependency",
          "v4_registry_resolver_dependency",
          "v4_scope_validator_dependency"
        ],
        "binding_artifact_ids": [
          "q1_root_v1_base_admission_orchestrator_v1"
        ],
        "binding_document_ids": [
          "schemas/t6-q-one-root-v1-base-admission-v1.schema.json",
          "scripts/t6_coordinator_role_registry_v5.py"
        ],
        "artifact_semantic_pins": {
          "q1_root_v1_base_admission_verifier_v1": "4fda677482ad484324281e49b1954de1ecfe1b04171aa582b5be767efd19e386",
          "q1_root_v1_base_materializer_v1": "6ea92f3962e4a25a58ed22cb32c54eadffbc7051f58fec69d361a71b072f92d9",
          "q1_root_v1_terminal_adapter_v1": "de912a0b385733faca21e8386be74b6db8b8006db526110625e512523d909321",
          "v1_persistent_state_contract_dependency": "f191dda2210195599ebbebd9aaa417513b695871b5884e8805f0c408a67a494f",
          "v3_production_receipt_verifier_dependency": "3b1d393fca94b81e7fe9acc8282b1543b591e1936f05efc6682fc7b9744323bc",
          "v3_root_initializer_dependency": "3d9870c8bcd22eb234c74850ed17b47723f9ef19d281cf90fb191a2a1f37371f",
          "v4_owner_classifier_dependency": "bfa1e7b07af56db15f3205db97964315dda123f3e76854ecc8e8d3ed9decc735",
          "v4_registry_resolver_dependency": "fcd2ba17b75761bd7c30c08ecf6204e7f97ec4735defd51fa7f7ca38e8fe78d3",
          "v4_scope_validator_dependency": "6bafd43416b27ae6f03486427a9705bc0d9fba2ef525a435abee819dc5de534d",
          "q1_root_v1_base_admission_orchestrator_v1": "169941d9369600db00cecffef380098f8e36d68fc1ee90e7cf23177ddea59937"
        }
      },
      "expected_blob_sha256": "b19a5dff8633592dc01a529fa74b39a08b5cedb94509848a34139e6e23eb2918",
      "expected_symbol_ast_sha256": {
        "verify_q_one_root_v1_base_admission_receipt_v1": "c210e05a173ef8829e676f3d167de444f7ae00c2b6ab284e335b64ee034139fa"
      },
      "expected_symbol_set_digest": "9367432ee12b4eb1ee40356bf751f4355e2f96af1342aaa35316767016300b37",
      "expected_local_import_closure_digest": "65b6e16ad5b98d217ac0f40ac7a12183da033b4a857fc7738358b1f910674f9c",
      "expected_dependency_manifest_digest": "d7ba7fbebfc743dbd9ccd7449932f94b1e28f72c8dcf5d4623e4f8d6eb36f514",
      "expected_semantic_sha256": "6d675621cb6e4a8f85cb5ab7965453db7756dc3ea76fcfed0601b8484a595d93"
    },
    {
      "artifact_id": "q1_root_v1_base_admission_verifier_v1",
      "artifact_class": "ROLE_ARTIFACT",
      "kind": "PYTHON_SYMBOL_SET",
      "path": "scripts/t6_q_one_root_v1_base_admission_verifier_v1.py",
      "symbols": [
        "verify_and_admit_q_one_root_v1_base_v1",
        "base_admission_receipt_to_mapping_v1"
      ],
      "pin_status": "PINNED",
      "semantic_digest_method": "PYTHON_STABLE_AST_SYMBOL_SET_BLOB_CLOSURE_DEPENDENCY_SHA256_V5",
      "dependency_manifest": {
        "execution_artifact_ids": [
          "v1_persistent_state_contract_dependency",
          "v3_root_initializer_dependency"
        ],
        "binding_artifact_ids": [
          "q1_root_v1_base_materializer_v1",
          "q1_root_v1_terminal_adapter_v1",
          "v3_production_receipt_verifier_dependency",
          "v4_owner_classifier_dependency",
          "v4_scope_validator_dependency"
        ],
        "binding_document_ids": [
          "schemas/t6-q-one-root-v1-base-admission-v1.schema.json"
        ],
        "artifact_semantic_pins": {
          "v1_persistent_state_contract_dependency": "f191dda2210195599ebbebd9aaa417513b695871b5884e8805f0c408a67a494f",
          "v3_root_initializer_dependency": "3d9870c8bcd22eb234c74850ed17b47723f9ef19d281cf90fb191a2a1f37371f",
          "q1_root_v1_base_materializer_v1": "6ea92f3962e4a25a58ed22cb32c54eadffbc7051f58fec69d361a71b072f92d9",
          "q1_root_v1_terminal_adapter_v1": "de912a0b385733faca21e8386be74b6db8b8006db526110625e512523d909321",
          "v3_production_receipt_verifier_dependency": "3b1d393fca94b81e7fe9acc8282b1543b591e1936f05efc6682fc7b9744323bc",
          "v4_owner_classifier_dependency": "bfa1e7b07af56db15f3205db97964315dda123f3e76854ecc8e8d3ed9decc735",
          "v4_scope_validator_dependency": "6bafd43416b27ae6f03486427a9705bc0d9fba2ef525a435abee819dc5de534d"
        }
      },
      "expected_blob_sha256": "b77c7594f032ad9a388cda98e1558f2778a175e06a351e3ef3fb5e793190dc59",
      "expected_symbol_ast_sha256": {
        "verify_and_admit_q_one_root_v1_base_v1": "c7102c039593fee8e19c603b7e9dab1350b208a8f00c81a49bf9129c3e4bd7c0",
        "base_admission_receipt_to_mapping_v1": "d02844008a2de1f06691f3cb6bd053221095c2611a2012251cb73129a7c5103a"
      },
      "expected_symbol_set_digest": "a3e081aff503f0fee815d17cb20ab736ce0facbe702763e6e5bd001312bcc40b",
      "expected_local_import_closure_digest": "2a1402f7fe824f1cc7f95eabede36866fe3cbcf9cd2d83161dd6b8000c331aae",
      "expected_dependency_manifest_digest": "40495614c0efc91bbc54c71e3610109e7fb280847dd0b656cdeb37372b8506b5",
      "expected_semantic_sha256": "4fda677482ad484324281e49b1954de1ecfe1b04171aa582b5be767efd19e386"
    },
    {
      "artifact_id": "q1_root_v1_base_materializer_v1",
      "artifact_class": "ROLE_ARTIFACT",
      "kind": "PYTHON_SYMBOL_SET",
      "path": "scripts/t6_q_one_root_v1_base_materializer_v1.py",
      "symbols": [